{
  "id": "people.propose-changes",
  "tool_name": "propose_people_changes",
  "verb": "People",
  "agents": [
    "clare",
    "hammond",
    "ann"
  ],
  "risk": "confirm",
  "kind": "capacity",
  "prompt_one_liner": "Add People, edit names/aliases, or link People to each other or to Organisations. Saved only after Adam's Confirm.",
  "surfaces": [
    "confirm_card",
    "governance_log"
  ]
}
