{
  "id": "career.propose-future",
  "tool_name": "propose_future",
  "verb": "Career",
  "agents": ["clare", "hammond", "ann"],
  "risk": "confirm",
  "kind": "capacity",
  "prompt_one_liner": "Propose adding a Career future. Saved only after Adam's Confirm.",
  "surfaces": ["confirm_card", "governance_log"]
}
