{
  "id": "travel.propose-item",
  "tool_name": "propose_travel_item",
  "verb": "Travel",
  "agents": ["clare", "hammond"],
  "risk": "confirm",
  "kind": "capacity",
  "prompt_one_liner": "Add an itinerary item to a Travel trip. Saved only after Adam's Confirm.",
  "surfaces": ["confirm_card", "travel", "governance_log"]
}
