{
  "id": "coordinate.request-cn-write",
  "tool_name": "coordinate_request_cn_write",
  "verb": "Coordinate",
  "agents": [
    "*"
  ],
  "risk": "auto",
  "kind": "capacity",
  "prompt_one_liner": "Write to Central Node. Your own signed Cross-Agent / Recent Actions line, a Today's Status field or a This Week line applies now. Constraints and every other change queue as a Confirm card for Adam on the Central Node page.",
  "surfaces": [
    "central_node",
    "confirm_card"
  ]
}
