{
  "id": "publish.calendar-ghost",
  "tool_name": "propose_calendar_ghost",
  "verb": "Publish",
  "agents": ["*"],
  "risk": "confirm",
  "kind": "capacity",
  "legacy_tool": "propose_calendar_ghost",
  "inputs": {
    "kind": "string",
    "date": "string",
    "reason": "string"
  },
  "side_effects": [
    "Appends a validated ghost to pending-calendar-ghosts.json",
    "Queues a chat Confirm card bound to the same ghost id",
    "Never writes Life, Central Node, Professional or Tasks until Confirm / Accept"
  ],
  "surfaces": ["confirm_card", "calendar"],
  "prompt_one_liner": "Propose something on Adam’s calendar (outing, meal time, workout time, protect, tasks, reschedule/cancel) or log a communication (kind log_comm). Queues a dashed ghost; Confirm in chat or Accept on the calendar.",
  "reads": ["pending-calendar-ghosts.json", "calendar-ghost-decisions.jsonl"]
}
